{"dependencies":[],"interface":{"conditions":[],"effects":[],"operations":["apply","binary:&&","call:choose","call:foldr"],"parameters":{"p":{"Arrow":[{"Value":{"Named":"A"}},{"Value":"Bool"}]},"q":{"Arrow":[{"Value":{"Named":"A"}},{"Value":"Bool"}]},"xs":{"Value":{"List":{"Named":"A"}}}},"result":{"Value":"Bool"}},"kind":"rewrite","payload":{"assumptions":[{"conditions":[{"from":{"node":{"Op":["apply",[{"node":{"Free":"p"},"sort":{"Arrow":[{"Value":{"Named":"A"}},{"Value":"Bool"}]}},{"node":{"Free":"item"},"sort":{"Value":{"Named":"A"}}}]]},"sort":{"Value":"Bool"}},"to":{"node":{"Bool":true},"sort":{"Value":"Bool"}}}],"from":{"node":{"Op":["apply",[{"node":{"Free":"q"},"sort":{"Arrow":[{"Value":{"Named":"A"}},{"Value":"Bool"}]}},{"node":{"Free":"item"},"sort":{"Value":{"Named":"A"}}}]]},"sort":{"Value":"Bool"}},"name":"implies","params":{"item":{"Value":{"Named":"A"}}},"to":{"node":{"Bool":true},"sort":{"Value":"Bool"}}}],"conditions":[],"from":{"node":{"Op":["call:choose",[{"node":{"Op":["call:foldr",[{"node":{"Free":"xs"},"sort":{"Value":{"List":{"Named":"A"}}}},{"node":{"Bool":true},"sort":{"Value":"Bool"}},{"node":{"Lambda":{"node":{"Lambda":{"node":{"Op":["binary:&&",[{"node":{"Op":["apply",[{"node":{"Free":"p"},"sort":{"Arrow":[{"Value":{"Named":"A"}},{"Value":"Bool"}]}},{"node":{"Bound":1},"sort":{"Value":{"Named":"A"}}}]]},"sort":{"Value":"Bool"}},{"node":{"Bound":0},"sort":{"Value":"Bool"}}]]},"sort":{"Value":"Bool"}}},"sort":{"Arrow":[{"Value":"Bool"},{"Value":"Bool"}]}}},"sort":{"Arrow":[{"Value":{"Named":"A"}},{"Arrow":[{"Value":"Bool"},{"Value":"Bool"}]}]}}]]},"sort":{"Value":"Bool"}},{"node":{"Op":["call:foldr",[{"node":{"Free":"xs"},"sort":{"Value":{"List":{"Named":"A"}}}},{"node":{"Bool":true},"sort":{"Value":"Bool"}},{"node":{"Lambda":{"node":{"Lambda":{"node":{"Op":["binary:&&",[{"node":{"Op":["apply",[{"node":{"Free":"q"},"sort":{"Arrow":[{"Value":{"Named":"A"}},{"Value":"Bool"}]}},{"node":{"Bound":1},"sort":{"Value":{"Named":"A"}}}]]},"sort":{"Value":"Bool"}},{"node":{"Bound":0},"sort":{"Value":"Bool"}}]]},"sort":{"Value":"Bool"}}},"sort":{"Arrow":[{"Value":"Bool"},{"Value":"Bool"}]}}},"sort":{"Arrow":[{"Value":{"Named":"A"}},{"Arrow":[{"Value":"Bool"},{"Value":"Bool"}]}]}}]]},"sort":{"Value":"Bool"}},{"node":{"Bool":true},"sort":{"Value":"Bool"}}]]},"sort":{"Value":"Bool"}},"params":{"p":{"Arrow":[{"Value":{"Named":"A"}},{"Value":"Bool"}]},"q":{"Arrow":[{"Value":{"Named":"A"}},{"Value":"Bool"}]},"xs":{"Value":{"List":{"Named":"A"}}}},"proof":{"Induction":{"base":"Normalize","names":["head","tail"],"step":{"Cases":{"condition":{"node":{"Op":["apply",[{"node":{"Free":"p"},"sort":{"Arrow":[{"Value":{"Named":"A"}},{"Value":"Bool"}]}},{"node":{"Free":"head"},"sort":{"Value":{"Named":"A"}}}]]},"sort":{"Value":"Bool"}},"on_false":"Normalize","on_true":{"Cases":{"condition":{"node":{"Op":["apply",[{"node":{"Free":"q"},"sort":{"Arrow":[{"Value":{"Named":"A"}},{"Value":"Bool"}]}},{"node":{"Free":"head"},"sort":{"Value":{"Named":"A"}}}]]},"sort":{"Value":"Bool"}},"on_false":{"Cases":{"condition":{"node":{"Op":["call:foldr",[{"node":{"Free":"tail"},"sort":{"Value":{"List":{"Named":"A"}}}},{"node":{"Bool":true},"sort":{"Value":"Bool"}},{"node":{"Lambda":{"node":{"Lambda":{"node":{"Op":["binary:&&",[{"node":{"Op":["apply",[{"node":{"Free":"p"},"sort":{"Arrow":[{"Value":{"Named":"A"}},{"Value":"Bool"}]}},{"node":{"Bound":1},"sort":{"Value":{"Named":"A"}}}]]},"sort":{"Value":"Bool"}},{"node":{"Bound":0},"sort":{"Value":"Bool"}}]]},"sort":{"Value":"Bool"}}},"sort":{"Arrow":[{"Value":"Bool"},{"Value":"Bool"}]}}},"sort":{"Arrow":[{"Value":{"Named":"A"}},{"Arrow":[{"Value":"Bool"},{"Value":"Bool"}]}]}}]]},"sort":{"Value":"Bool"}},"on_false":"Normalize","on_true":{"Trans":{"left":"Normalize","middle":{"node":{"Op":["apply",[{"node":{"Free":"q"},"sort":{"Arrow":[{"Value":{"Named":"A"}},{"Value":"Bool"}]}},{"node":{"Free":"head"},"sort":{"Value":{"Named":"A"}}}]]},"sort":{"Value":"Bool"}},"right":{"Assume":{"arguments":{"item":{"node":{"Free":"head"},"sort":{"Value":{"Named":"A"}}}},"index":0,"premises":["Normalize"]}}}}}},"on_true":{"Trans":{"left":"Normalize","middle":{"node":{"Op":["call:choose",[{"node":{"Op":["call:foldr",[{"node":{"Free":"tail"},"sort":{"Value":{"List":{"Named":"A"}}}},{"node":{"Bool":true},"sort":{"Value":"Bool"}},{"node":{"Lambda":{"node":{"Lambda":{"node":{"Op":["binary:&&",[{"node":{"Op":["apply",[{"node":{"Free":"p"},"sort":{"Arrow":[{"Value":{"Named":"A"}},{"Value":"Bool"}]}},{"node":{"Bound":1},"sort":{"Value":{"Named":"A"}}}]]},"sort":{"Value":"Bool"}},{"node":{"Bound":0},"sort":{"Value":"Bool"}}]]},"sort":{"Value":"Bool"}}},"sort":{"Arrow":[{"Value":"Bool"},{"Value":"Bool"}]}}},"sort":{"Arrow":[{"Value":{"Named":"A"}},{"Arrow":[{"Value":"Bool"},{"Value":"Bool"}]}]}}]]},"sort":{"Value":"Bool"}},{"node":{"Op":["call:foldr",[{"node":{"Free":"tail"},"sort":{"Value":{"List":{"Named":"A"}}}},{"node":{"Bool":true},"sort":{"Value":"Bool"}},{"node":{"Lambda":{"node":{"Lambda":{"node":{"Op":["binary:&&",[{"node":{"Op":["apply",[{"node":{"Free":"q"},"sort":{"Arrow":[{"Value":{"Named":"A"}},{"Value":"Bool"}]}},{"node":{"Bound":1},"sort":{"Value":{"Named":"A"}}}]]},"sort":{"Value":"Bool"}},{"node":{"Bound":0},"sort":{"Value":"Bool"}}]]},"sort":{"Value":"Bool"}}},"sort":{"Arrow":[{"Value":"Bool"},{"Value":"Bool"}]}}},"sort":{"Arrow":[{"Value":{"Named":"A"}},{"Arrow":[{"Value":"Bool"},{"Value":"Bool"}]}]}}]]},"sort":{"Value":"Bool"}},{"node":{"Bool":true},"sort":{"Value":"Bool"}}]]},"sort":{"Value":"Bool"}},"right":{"Hypothesis":0}}}}}}},"variable":"xs"}},"to":{"node":{"Bool":true},"sort":{"Value":"Bool"}},"types":["A"]},"schema":1,"semantics":"ink-general-laws-v1"}
