{"dependencies":["0b82c59bf15e551e176949b916544f67dde263a9f75f1ec465ac2b2dbfa26f9d","474aca4c64ac507e51414e3ae5a86dd90b62e855a278e97c55f54a514b35a23f","6d16b0db4ae1b97f34961bb2f1bd9849a0c413831bbf3b8603988d0c474fbc70","782628ab95dd828a24fb4b442e55f58436200200a31424ec2d88eeac2d8957ac","90d019f3bff7dfad54375d536ab586d6bd583cc7f5740c065404b0d38e8272c5","9d8945d011aad39bd2cbae26176ba49ac968ead2dd1578b57377544dd87b74ba","a02900963d57d97aa1fe55df523348d493b722a2443aac9e13c6f54caadaf9fc","ad862b00d24208120f5c5b42ce8dd8fb9198b9d2a48530717c923a55dde3e187","dd9122cd0ef5414b8f184fc5a412c2e0c7b9002cb5d701ef49dc7b9f5465679c"],"interface":{"conditions":[{"from":{"Call":{"arguments":[{"Call":{"arguments":[{"Var":"side_left"},{"Var":"right"}],"function":"dd9122cd0ef5414b8f184fc5a412c2e0c7b9002cb5d701ef49dc7b9f5465679c"}}],"function":"474aca4c64ac507e51414e3ae5a86dd90b62e855a278e97c55f54a514b35a23f"}},"to":{"Call":{"arguments":[{"Call":{"arguments":[{"Var":"side_left"}],"function":"474aca4c64ac507e51414e3ae5a86dd90b62e855a278e97c55f54a514b35a23f"}},{"Call":{"arguments":[{"Var":"right"}],"function":"474aca4c64ac507e51414e3ae5a86dd90b62e855a278e97c55f54a514b35a23f"}}],"function":"a02900963d57d97aa1fe55df523348d493b722a2443aac9e13c6f54caadaf9fc"}}},{"from":{"Call":{"arguments":[{"Call":{"arguments":[{"Var":"side_right"},{"Var":"right"}],"function":"dd9122cd0ef5414b8f184fc5a412c2e0c7b9002cb5d701ef49dc7b9f5465679c"}}],"function":"474aca4c64ac507e51414e3ae5a86dd90b62e855a278e97c55f54a514b35a23f"}},"to":{"Call":{"arguments":[{"Call":{"arguments":[{"Var":"side_right"}],"function":"474aca4c64ac507e51414e3ae5a86dd90b62e855a278e97c55f54a514b35a23f"}},{"Call":{"arguments":[{"Var":"right"}],"function":"474aca4c64ac507e51414e3ae5a86dd90b62e855a278e97c55f54a514b35a23f"}}],"function":"a02900963d57d97aa1fe55df523348d493b722a2443aac9e13c6f54caadaf9fc"}}}],"effects":[],"operations":["call:0b82c59bf15e551e176949b916544f67dde263a9f75f1ec465ac2b2dbfa26f9d","call:474aca4c64ac507e51414e3ae5a86dd90b62e855a278e97c55f54a514b35a23f","call:a02900963d57d97aa1fe55df523348d493b722a2443aac9e13c6f54caadaf9fc","call:dd9122cd0ef5414b8f184fc5a412c2e0c7b9002cb5d701ef49dc7b9f5465679c"],"parameters":{"right":{"Data":"9d8945d011aad39bd2cbae26176ba49ac968ead2dd1578b57377544dd87b74ba"},"side_count":"U64","side_height":"U64","side_hi":"U64","side_left":{"Data":"9d8945d011aad39bd2cbae26176ba49ac968ead2dd1578b57377544dd87b74ba"},"side_lo":"U64","side_right":{"Data":"9d8945d011aad39bd2cbae26176ba49ac968ead2dd1578b57377544dd87b74ba"},"side_sum":"U64"},"result":null},"kind":"theorem","payload":{"declaration":{"Theorem":{"conditions":[{"from":{"Call":{"arguments":[{"Call":{"arguments":[{"Var":"side_left"},{"Var":"right"}],"function":"dd9122cd0ef5414b8f184fc5a412c2e0c7b9002cb5d701ef49dc7b9f5465679c"}}],"function":"474aca4c64ac507e51414e3ae5a86dd90b62e855a278e97c55f54a514b35a23f"}},"to":{"Call":{"arguments":[{"Call":{"arguments":[{"Var":"side_left"}],"function":"474aca4c64ac507e51414e3ae5a86dd90b62e855a278e97c55f54a514b35a23f"}},{"Call":{"arguments":[{"Var":"right"}],"function":"474aca4c64ac507e51414e3ae5a86dd90b62e855a278e97c55f54a514b35a23f"}}],"function":"a02900963d57d97aa1fe55df523348d493b722a2443aac9e13c6f54caadaf9fc"}}},{"from":{"Call":{"arguments":[{"Call":{"arguments":[{"Var":"side_right"},{"Var":"right"}],"function":"dd9122cd0ef5414b8f184fc5a412c2e0c7b9002cb5d701ef49dc7b9f5465679c"}}],"function":"474aca4c64ac507e51414e3ae5a86dd90b62e855a278e97c55f54a514b35a23f"}},"to":{"Call":{"arguments":[{"Call":{"arguments":[{"Var":"side_right"}],"function":"474aca4c64ac507e51414e3ae5a86dd90b62e855a278e97c55f54a514b35a23f"}},{"Call":{"arguments":[{"Var":"right"}],"function":"474aca4c64ac507e51414e3ae5a86dd90b62e855a278e97c55f54a514b35a23f"}}],"function":"a02900963d57d97aa1fe55df523348d493b722a2443aac9e13c6f54caadaf9fc"}}}],"from":{"Call":{"arguments":[{"Call":{"arguments":[{"Construct":{"arguments":[{"Var":"side_left"},{"Var":"side_right"},{"Var":"side_lo"},{"Var":"side_hi"},{"Var":"side_sum"},{"Var":"side_count"},{"Var":"side_height"}],"constructor":2,"datatype":"9d8945d011aad39bd2cbae26176ba49ac968ead2dd1578b57377544dd87b74ba"}},{"Var":"right"}],"function":"0b82c59bf15e551e176949b916544f67dde263a9f75f1ec465ac2b2dbfa26f9d"}}],"function":"474aca4c64ac507e51414e3ae5a86dd90b62e855a278e97c55f54a514b35a23f"}},"params":[["right",{"Data":"9d8945d011aad39bd2cbae26176ba49ac968ead2dd1578b57377544dd87b74ba"}],["side_left",{"Data":"9d8945d011aad39bd2cbae26176ba49ac968ead2dd1578b57377544dd87b74ba"}],["side_right",{"Data":"9d8945d011aad39bd2cbae26176ba49ac968ead2dd1578b57377544dd87b74ba"}],["side_lo","U64"],["side_hi","U64"],["side_sum","U64"],["side_count","U64"],["side_height","U64"]],"proof":{"Trans":[{"Trans":[{"Use":{"arguments":[{"Construct":{"arguments":[{"Var":"side_left"},{"Var":"side_right"},{"Var":"side_lo"},{"Var":"side_hi"},{"Var":"side_sum"},{"Var":"side_count"},{"Var":"side_height"}],"constructor":2,"datatype":"9d8945d011aad39bd2cbae26176ba49ac968ead2dd1578b57377544dd87b74ba"}},{"Var":"right"}],"premises":[],"theorem":"6d16b0db4ae1b97f34961bb2f1bd9849a0c413831bbf3b8603988d0c474fbc70"}},{"Call":{"arguments":[{"Refl":{"Call":{"arguments":[{"Construct":{"arguments":[{"Var":"side_left"},{"Var":"side_right"},{"Var":"side_lo"},{"Var":"side_hi"},{"Var":"side_sum"},{"Var":"side_count"},{"Var":"side_height"}],"constructor":2,"datatype":"9d8945d011aad39bd2cbae26176ba49ac968ead2dd1578b57377544dd87b74ba"}}],"function":"474aca4c64ac507e51414e3ae5a86dd90b62e855a278e97c55f54a514b35a23f"}}},{"Refl":{"Call":{"arguments":[{"Var":"right"}],"function":"474aca4c64ac507e51414e3ae5a86dd90b62e855a278e97c55f54a514b35a23f"}}}],"function":"a02900963d57d97aa1fe55df523348d493b722a2443aac9e13c6f54caadaf9fc"}}]},{"Use":{"arguments":[{"Var":"right"},{"Var":"side_left"},{"Var":"side_right"},{"Var":"side_lo"},{"Var":"side_hi"},{"Var":"side_sum"},{"Var":"side_count"},{"Var":"side_height"}],"premises":[{"Hypothesis":0},{"Hypothesis":1}],"theorem":"ad862b00d24208120f5c5b42ce8dd8fb9198b9d2a48530717c923a55dde3e187"}}]},"to":{"Call":{"arguments":[{"Call":{"arguments":[{"Construct":{"arguments":[{"Var":"side_left"},{"Var":"side_right"},{"Var":"side_lo"},{"Var":"side_hi"},{"Var":"side_sum"},{"Var":"side_count"},{"Var":"side_height"}],"constructor":2,"datatype":"9d8945d011aad39bd2cbae26176ba49ac968ead2dd1578b57377544dd87b74ba"}}],"function":"474aca4c64ac507e51414e3ae5a86dd90b62e855a278e97c55f54a514b35a23f"}},{"Call":{"arguments":[{"Var":"right"}],"function":"474aca4c64ac507e51414e3ae5a86dd90b62e855a278e97c55f54a514b35a23f"}}],"function":"a02900963d57d97aa1fe55df523348d493b722a2443aac9e13c6f54caadaf9fc"}}}}},"schema":1,"semantics":"first-order-inductive-equality-v1"}
