{"dependencies":["4afdd054301c0ea19aa84ce4e56f87045589a220aaa7646537eeef1a98549ebd","d001b1994dec9ebd8759d30d8cfb1e0ddbfc9502a693bd1a98bad474b320cbf5","f339924e96a0f1faa8f0889189000a6e336e4b39437ec268a3b71bd085148b25"],"interface":{"conditions":[],"effects":[],"operations":["call:4afdd054301c0ea19aa84ce4e56f87045589a220aaa7646537eeef1a98549ebd"],"parameters":{"rows":{"Data":"d001b1994dec9ebd8759d30d8cfb1e0ddbfc9502a693bd1a98bad474b320cbf5"}},"result":{"Data":"f339924e96a0f1faa8f0889189000a6e336e4b39437ec268a3b71bd085148b25"}},"kind":"definition","payload":{"declaration":{"Function":{"body":{"Match":{"branches":[{"bindings":[],"body":{"Construct":{"arguments":[],"constructor":0,"datatype":"f339924e96a0f1faa8f0889189000a6e336e4b39437ec268a3b71bd085148b25"}}},{"bindings":["key","row","tail"],"body":{"Construct":{"arguments":[{"Call":{"arguments":[{"Var":"row"}],"function":"4afdd054301c0ea19aa84ce4e56f87045589a220aaa7646537eeef1a98549ebd"}},{"SelfCall":[{"Var":"tail"}]}],"constructor":1,"datatype":"f339924e96a0f1faa8f0889189000a6e336e4b39437ec268a3b71bd085148b25"}}}],"scrutinee":{"Var":"rows"}}},"params":[["rows",{"Data":"d001b1994dec9ebd8759d30d8cfb1e0ddbfc9502a693bd1a98bad474b320cbf5"}]],"recursive":0,"result":{"Data":"f339924e96a0f1faa8f0889189000a6e336e4b39437ec268a3b71bd085148b25"}}}},"schema":1,"semantics":"first-order-inductive-equality-v1"}
