{"dependencies":["5fa07af2d0fbc8bf1468deb1820d582b0c8cc24477c6c0c9f4073913f5e2447b","8f271e55ac06a47dbe51e15c43c8b8c0c03e0019b7ea3373717515f395cfcc90","adcd3fa9b78c3423a2204ad28dca815dad36dad9f2d4c473523118840077a669"],"interface":{"conditions":[],"effects":[],"operations":["call:5fa07af2d0fbc8bf1468deb1820d582b0c8cc24477c6c0c9f4073913f5e2447b"],"parameters":{"logical":{"Data":"adcd3fa9b78c3423a2204ad28dca815dad36dad9f2d4c473523118840077a669"},"physical":{"Data":"8f271e55ac06a47dbe51e15c43c8b8c0c03e0019b7ea3373717515f395cfcc90"}},"result":{"Data":"8f271e55ac06a47dbe51e15c43c8b8c0c03e0019b7ea3373717515f395cfcc90"}},"kind":"definition","payload":{"declaration":{"Function":{"body":{"Call":{"arguments":[{"Var":"logical"}],"function":"5fa07af2d0fbc8bf1468deb1820d582b0c8cc24477c6c0c9f4073913f5e2447b"}},"params":[["physical",{"Data":"8f271e55ac06a47dbe51e15c43c8b8c0c03e0019b7ea3373717515f395cfcc90"}],["logical",{"Data":"adcd3fa9b78c3423a2204ad28dca815dad36dad9f2d4c473523118840077a669"}]],"recursive":null,"result":{"Data":"8f271e55ac06a47dbe51e15c43c8b8c0c03e0019b7ea3373717515f395cfcc90"}}}},"schema":1,"semantics":"first-order-inductive-equality-v1"}
