{"dependencies":["0c85067b81f28551691c880c2dc5267992f53f4779c1c6b767b8b091f6cb2d92","1b2ffc4e25c0c1fced770a98ac53cb2c14883fe1c17c7382d8ba07ae783d20c5","1e9eaedfcc9ddd990078215c323cd6062d64ad0c402aa8f1934e20a0660344c0","1e9f375da8ef648a43f1266636ce3341878694e5ba16d30ad579e152c0913819","2d11fa3d187b1e0a4324b097c0b3dd7c0cf9005531577cb408d302c20b33bec2","3434f686e1987a2a9303539ecca913a993f4d6251f012ee410cb3f2e24af67e7","34b59650fe6d2ba26f9ce07fe577afab7a77aba00b0375c857f54e5f1d56bd3b","5b7383b7d8ffe1e0e399b076aa7dd16f31c80a624adf10542e3c79cf1932787f","5b79e0c0bf10364ad94e0e2c9eb8e0b76a3e1fe59812dce2fdc39ca2563dbef3","61c8c3e1bb9f95a9af20619dbd62fad0c096ffc663643a78cba3d7a2277b8a28","6ee85f9ff598489f71cec322f484df18de1db42ea938f9255ce18813fe998e0e","7cc9b1f30bd0585ff26fde9d7092b26a24d22a6f15c0ce8b971878a9311cc642","9f34d99220027cce18cca80d0de697902964c31cf51b93bf2e58ff6aa3d6eaa5","baa9fb170ac2322a5cbf5fab9c84873a889f82bfd5054af51e8177bfc756899c","c027fba0903ad9a7ca4616e3403216f59cf216012b8f53bd5b48b6a97132d023","c3176609fac43c8d2bea98aa3fb46d3ce2cdcfa3e91782e5dd1fe1d504736d7a","ee312fd83b866d225f57a7c267a11359759f3af15e848ae9cfe360c17e27e8cb","f42cc8625457738db34aacc455c976c9cb46baf6e5af40a76ba65f2cfbec7348"],"interface":{"conditions":[],"effects":[],"operations":["call:3434f686e1987a2a9303539ecca913a993f4d6251f012ee410cb3f2e24af67e7","call:34b59650fe6d2ba26f9ce07fe577afab7a77aba00b0375c857f54e5f1d56bd3b","call:5b7383b7d8ffe1e0e399b076aa7dd16f31c80a624adf10542e3c79cf1932787f"],"parameters":{"arg_0":"U64","arg_1":"U64","arg_2":"U64","physical":{"Data":"c3176609fac43c8d2bea98aa3fb46d3ce2cdcfa3e91782e5dd1fe1d504736d7a"},"version":"U64"},"result":null},"kind":"theorem","payload":{"declaration":{"Theorem":{"conditions":[],"from":{"Call":{"arguments":[{"Call":{"arguments":[{"Call":{"arguments":[{"Call":{"arguments":[{"Var":"physical"}],"function":"5b7383b7d8ffe1e0e399b076aa7dd16f31c80a624adf10542e3c79cf1932787f"}},{"Var":"version"},{"Var":"arg_0"},{"Var":"arg_1"},{"Var":"arg_2"}],"function":"3434f686e1987a2a9303539ecca913a993f4d6251f012ee410cb3f2e24af67e7"}}],"function":"34b59650fe6d2ba26f9ce07fe577afab7a77aba00b0375c857f54e5f1d56bd3b"}}],"function":"5b7383b7d8ffe1e0e399b076aa7dd16f31c80a624adf10542e3c79cf1932787f"}},"params":[["physical",{"Data":"c3176609fac43c8d2bea98aa3fb46d3ce2cdcfa3e91782e5dd1fe1d504736d7a"}],["version","U64"],["arg_0","U64"],["arg_1","U64"],["arg_2","U64"]],"proof":{"Induction":{"cases":[{"bindings":["indexed_root_0","indexed_root_1","indexed_root_2","indexed_root_3","indexed_root_4","indexed_root_5"],"proof":{"Use":{"arguments":[{"Var":"indexed_root_0"},{"Var":"indexed_root_1"},{"Var":"indexed_root_2"},{"Var":"indexed_root_3"},{"Var":"indexed_root_4"},{"Var":"indexed_root_5"},{"Var":"version"},{"Var":"arg_0"},{"Var":"arg_1"},{"Var":"arg_2"}],"premises":[],"theorem":"9f34d99220027cce18cca80d0de697902964c31cf51b93bf2e58ff6aa3d6eaa5"}}}],"from":{"Call":{"arguments":[{"Call":{"arguments":[{"Call":{"arguments":[{"Call":{"arguments":[{"Var":"physical"}],"function":"5b7383b7d8ffe1e0e399b076aa7dd16f31c80a624adf10542e3c79cf1932787f"}},{"Var":"version"},{"Var":"arg_0"},{"Var":"arg_1"},{"Var":"arg_2"}],"function":"3434f686e1987a2a9303539ecca913a993f4d6251f012ee410cb3f2e24af67e7"}}],"function":"34b59650fe6d2ba26f9ce07fe577afab7a77aba00b0375c857f54e5f1d56bd3b"}}],"function":"5b7383b7d8ffe1e0e399b076aa7dd16f31c80a624adf10542e3c79cf1932787f"}},"to":{"Call":{"arguments":[{"Call":{"arguments":[{"Call":{"arguments":[{"Var":"physical"}],"function":"5b7383b7d8ffe1e0e399b076aa7dd16f31c80a624adf10542e3c79cf1932787f"}},{"Var":"version"},{"Var":"arg_0"},{"Var":"arg_1"},{"Var":"arg_2"}],"function":"3434f686e1987a2a9303539ecca913a993f4d6251f012ee410cb3f2e24af67e7"}}],"function":"34b59650fe6d2ba26f9ce07fe577afab7a77aba00b0375c857f54e5f1d56bd3b"}},"variable":"physical"}},"to":{"Call":{"arguments":[{"Call":{"arguments":[{"Call":{"arguments":[{"Var":"physical"}],"function":"5b7383b7d8ffe1e0e399b076aa7dd16f31c80a624adf10542e3c79cf1932787f"}},{"Var":"version"},{"Var":"arg_0"},{"Var":"arg_1"},{"Var":"arg_2"}],"function":"3434f686e1987a2a9303539ecca913a993f4d6251f012ee410cb3f2e24af67e7"}}],"function":"34b59650fe6d2ba26f9ce07fe577afab7a77aba00b0375c857f54e5f1d56bd3b"}}}}},"schema":1,"semantics":"first-order-inductive-equality-v1"}
