{"dependencies":["0b2896fb7d4c314eaa4cc523062f4bd60f41252eb902ea01642e234e34631989","110ad60f3c1683f6b79607a26ebc37c047562e55dd505d396196a1cf0e47d0ff","1766594606572caae093691ee36f214bcd9165f3a6e4f8f07f0e2882d2657d20","21fe09113fe56a272ab565ab4aef7285fe5fd5a3732acf7e64eb606601da7041","278f96199151750d38923eeddb65a2c9b439d8b9d36ae2f7f74c9045f0fffb08","348df119634cadd64012c32f53b0ae5bff1045e4f0602ab07e12771c8bca84b9","3b01e83ed63a97250c8f98bfe06df656c66cf51970b389324840292525a5eb7b","6f8e415e736e12c21104a8af10e51765553fc40e02938896d3db102301246906","6fb70d0ae302353570efe099ec6b68ed9f8dbaff3bab8b66be8ff802d60e925a","70e688e22d70f509933d86798827545906a33c9094356ad2715da19f9a858186","782628ab95dd828a24fb4b442e55f58436200200a31424ec2d88eeac2d8957ac","7ab58469556b7477018be1ec17a0774bb1f2faf62ae60a6ba08190b8047763df","7ab6324e9b115ea824495a8cb770f2d2d0381a9ed8f0b9b40f2112c8fd50fd0c","90d019f3bff7dfad54375d536ab586d6bd583cc7f5740c065404b0d38e8272c5","92368800572ebbcfe203c07e2d7e7e00d60743f84b2b815a526d470566792f7f","9d88fbbc16997ba4b9de305ab59459ccdb526b74c4ee3b4cfeef7e18b1d18418","adcd3fa9b78c3423a2204ad28dca815dad36dad9f2d4c473523118840077a669","afa16a5a00c36ddb20047c8d864e70e4cf8562c6cba006aad975c40d9b1d4c20","b0bf897e4894cbe32c22fd6076f9458542fbdc25a9641bd507d85784efe0d5ac","baa9fb170ac2322a5cbf5fab9c84873a889f82bfd5054af51e8177bfc756899c","c6927b0865f87bb196f15f68b8badb81fa1be85d4df74ec9dc19dc46fb41576b","d04de2692bfff791846c60726fe4f6855cedbdbf95284fe26bd5d5523a05b14b","e6bf73f7b6192bd23553a508712ea025a084d5377320268e456bca5883de6748","ecb5f0fe765c23cab036dab5aeb85724371c831e3e4d63eb81588998f75d7798"],"interface":{"conditions":[{"from":{"Binary":{"left":{"Call":{"arguments":[{"Var":"left"}],"function":"afa16a5a00c36ddb20047c8d864e70e4cf8562c6cba006aad975c40d9b1d4c20"}},"op":"&&","right":{"Call":{"arguments":[{"Var":"right"}],"function":"afa16a5a00c36ddb20047c8d864e70e4cf8562c6cba006aad975c40d9b1d4c20"}}}},"to":{"Bool":true}},{"from":{"Binary":{"left":{"Call":{"arguments":[{"Var":"left"}],"function":"110ad60f3c1683f6b79607a26ebc37c047562e55dd505d396196a1cf0e47d0ff"}},"op":">","right":{"Binary":{"left":{"Call":{"arguments":[{"Var":"right"}],"function":"110ad60f3c1683f6b79607a26ebc37c047562e55dd505d396196a1cf0e47d0ff"}},"op":"+","right":{"U64":1}}}}},"to":{"Bool":false}},{"from":{"Binary":{"left":{"Call":{"arguments":[{"Var":"right"}],"function":"110ad60f3c1683f6b79607a26ebc37c047562e55dd505d396196a1cf0e47d0ff"}},"op":">","right":{"Binary":{"left":{"Call":{"arguments":[{"Var":"left"}],"function":"110ad60f3c1683f6b79607a26ebc37c047562e55dd505d396196a1cf0e47d0ff"}},"op":"+","right":{"U64":1}}}}},"to":{"Bool":true}},{"from":{"Var":"right"},"to":{"Construct":{"arguments":[{"Var":"tree_case_74_0"},{"Var":"tree_case_74_1"},{"Var":"tree_case_74_2"},{"Var":"tree_case_74_3"},{"Var":"tree_case_74_4"},{"Var":"tree_case_74_5"}],"constructor":2,"datatype":"9d88fbbc16997ba4b9de305ab59459ccdb526b74c4ee3b4cfeef7e18b1d18418"}}},{"from":{"Binary":{"left":{"Call":{"arguments":[{"Var":"tree_case_74_1"}],"function":"110ad60f3c1683f6b79607a26ebc37c047562e55dd505d396196a1cf0e47d0ff"}},"op":">=","right":{"Call":{"arguments":[{"Var":"tree_case_74_0"}],"function":"110ad60f3c1683f6b79607a26ebc37c047562e55dd505d396196a1cf0e47d0ff"}}}},"to":{"Bool":false}},{"from":{"Var":"tree_case_74_0"},"to":{"Construct":{"arguments":[{"Var":"tree_case_77_0"},{"Var":"tree_case_77_1"},{"Var":"tree_case_77_2"},{"Var":"tree_case_77_3"},{"Var":"tree_case_77_4"},{"Var":"tree_case_77_5"}],"constructor":2,"datatype":"9d88fbbc16997ba4b9de305ab59459ccdb526b74c4ee3b4cfeef7e18b1d18418"}}}],"effects":[],"operations":["binary:&&","binary:+","binary:>","binary:>=","call:110ad60f3c1683f6b79607a26ebc37c047562e55dd505d396196a1cf0e47d0ff","call:7ab6324e9b115ea824495a8cb770f2d2d0381a9ed8f0b9b40f2112c8fd50fd0c","call:afa16a5a00c36ddb20047c8d864e70e4cf8562c6cba006aad975c40d9b1d4c20","call:d04de2692bfff791846c60726fe4f6855cedbdbf95284fe26bd5d5523a05b14b"],"parameters":{"left":{"Data":"9d88fbbc16997ba4b9de305ab59459ccdb526b74c4ee3b4cfeef7e18b1d18418"},"right":{"Data":"9d88fbbc16997ba4b9de305ab59459ccdb526b74c4ee3b4cfeef7e18b1d18418"},"tree_case_74_0":{"Data":"9d88fbbc16997ba4b9de305ab59459ccdb526b74c4ee3b4cfeef7e18b1d18418"},"tree_case_74_1":{"Data":"9d88fbbc16997ba4b9de305ab59459ccdb526b74c4ee3b4cfeef7e18b1d18418"},"tree_case_74_2":"U64","tree_case_74_3":"U64","tree_case_74_4":"U64","tree_case_74_5":"U64","tree_case_77_0":{"Data":"9d88fbbc16997ba4b9de305ab59459ccdb526b74c4ee3b4cfeef7e18b1d18418"},"tree_case_77_1":{"Data":"9d88fbbc16997ba4b9de305ab59459ccdb526b74c4ee3b4cfeef7e18b1d18418"},"tree_case_77_2":"U64","tree_case_77_3":"U64","tree_case_77_4":"U64","tree_case_77_5":"U64"},"result":null},"kind":"theorem","payload":{"declaration":{"Theorem":{"conditions":[{"from":{"Binary":{"left":{"Call":{"arguments":[{"Var":"left"}],"function":"afa16a5a00c36ddb20047c8d864e70e4cf8562c6cba006aad975c40d9b1d4c20"}},"op":"&&","right":{"Call":{"arguments":[{"Var":"right"}],"function":"afa16a5a00c36ddb20047c8d864e70e4cf8562c6cba006aad975c40d9b1d4c20"}}}},"to":{"Bool":true}},{"from":{"Binary":{"left":{"Call":{"arguments":[{"Var":"left"}],"function":"110ad60f3c1683f6b79607a26ebc37c047562e55dd505d396196a1cf0e47d0ff"}},"op":">","right":{"Binary":{"left":{"Call":{"arguments":[{"Var":"right"}],"function":"110ad60f3c1683f6b79607a26ebc37c047562e55dd505d396196a1cf0e47d0ff"}},"op":"+","right":{"U64":1}}}}},"to":{"Bool":false}},{"from":{"Binary":{"left":{"Call":{"arguments":[{"Var":"right"}],"function":"110ad60f3c1683f6b79607a26ebc37c047562e55dd505d396196a1cf0e47d0ff"}},"op":">","right":{"Binary":{"left":{"Call":{"arguments":[{"Var":"left"}],"function":"110ad60f3c1683f6b79607a26ebc37c047562e55dd505d396196a1cf0e47d0ff"}},"op":"+","right":{"U64":1}}}}},"to":{"Bool":true}},{"from":{"Var":"right"},"to":{"Construct":{"arguments":[{"Var":"tree_case_74_0"},{"Var":"tree_case_74_1"},{"Var":"tree_case_74_2"},{"Var":"tree_case_74_3"},{"Var":"tree_case_74_4"},{"Var":"tree_case_74_5"}],"constructor":2,"datatype":"9d88fbbc16997ba4b9de305ab59459ccdb526b74c4ee3b4cfeef7e18b1d18418"}}},{"from":{"Binary":{"left":{"Call":{"arguments":[{"Var":"tree_case_74_1"}],"function":"110ad60f3c1683f6b79607a26ebc37c047562e55dd505d396196a1cf0e47d0ff"}},"op":">=","right":{"Call":{"arguments":[{"Var":"tree_case_74_0"}],"function":"110ad60f3c1683f6b79607a26ebc37c047562e55dd505d396196a1cf0e47d0ff"}}}},"to":{"Bool":false}},{"from":{"Var":"tree_case_74_0"},"to":{"Construct":{"arguments":[{"Var":"tree_case_77_0"},{"Var":"tree_case_77_1"},{"Var":"tree_case_77_2"},{"Var":"tree_case_77_3"},{"Var":"tree_case_77_4"},{"Var":"tree_case_77_5"}],"constructor":2,"datatype":"9d88fbbc16997ba4b9de305ab59459ccdb526b74c4ee3b4cfeef7e18b1d18418"}}}],"from":{"If":{"condition":{"Binary":{"left":{"Call":{"arguments":[{"Var":"left"}],"function":"afa16a5a00c36ddb20047c8d864e70e4cf8562c6cba006aad975c40d9b1d4c20"}},"op":"&&","right":{"Call":{"arguments":[{"Var":"right"}],"function":"afa16a5a00c36ddb20047c8d864e70e4cf8562c6cba006aad975c40d9b1d4c20"}}}},"on_false":{"Bool":true},"on_true":{"Call":{"arguments":[{"Call":{"arguments":[{"Var":"left"},{"Var":"right"}],"function":"7ab6324e9b115ea824495a8cb770f2d2d0381a9ed8f0b9b40f2112c8fd50fd0c"}}],"function":"afa16a5a00c36ddb20047c8d864e70e4cf8562c6cba006aad975c40d9b1d4c20"}}}},"params":[["left",{"Data":"9d88fbbc16997ba4b9de305ab59459ccdb526b74c4ee3b4cfeef7e18b1d18418"}],["right",{"Data":"9d88fbbc16997ba4b9de305ab59459ccdb526b74c4ee3b4cfeef7e18b1d18418"}],["tree_case_74_0",{"Data":"9d88fbbc16997ba4b9de305ab59459ccdb526b74c4ee3b4cfeef7e18b1d18418"}],["tree_case_74_1",{"Data":"9d88fbbc16997ba4b9de305ab59459ccdb526b74c4ee3b4cfeef7e18b1d18418"}],["tree_case_74_2","U64"],["tree_case_74_3","U64"],["tree_case_74_4","U64"],["tree_case_74_5","U64"],["tree_case_77_0",{"Data":"9d88fbbc16997ba4b9de305ab59459ccdb526b74c4ee3b4cfeef7e18b1d18418"}],["tree_case_77_1",{"Data":"9d88fbbc16997ba4b9de305ab59459ccdb526b74c4ee3b4cfeef7e18b1d18418"}],["tree_case_77_2","U64"],["tree_case_77_3","U64"],["tree_case_77_4","U64"],["tree_case_77_5","U64"]],"proof":{"Trans":[{"Use":{"arguments":[{"Var":"left"},{"Var":"right"},{"Var":"tree_case_74_0"},{"Var":"tree_case_74_1"},{"Var":"tree_case_74_2"},{"Var":"tree_case_74_3"},{"Var":"tree_case_74_4"},{"Var":"tree_case_74_5"},{"Var":"tree_case_77_0"},{"Var":"tree_case_77_1"},{"Var":"tree_case_77_2"},{"Var":"tree_case_77_3"},{"Var":"tree_case_77_4"},{"Var":"tree_case_77_5"}],"premises":[{"Hypothesis":0},{"Hypothesis":1},{"Hypothesis":2},{"Hypothesis":3},{"Hypothesis":4},{"Hypothesis":5}],"theorem":"348df119634cadd64012c32f53b0ae5bff1045e4f0602ab07e12771c8bca84b9"}},{"Substitute":{"context":{"Var":"tree_proof_hole"},"equality":{"Use":{"arguments":[{"Call":{"arguments":[{"Var":"left"},{"Var":"tree_case_77_0"}],"function":"d04de2692bfff791846c60726fe4f6855cedbdbf95284fe26bd5d5523a05b14b"}},{"Call":{"arguments":[{"Var":"tree_case_77_1"},{"Var":"tree_case_74_1"}],"function":"d04de2692bfff791846c60726fe4f6855cedbdbf95284fe26bd5d5523a05b14b"}}],"premises":[{"Use":{"arguments":[{"Var":"left"},{"Var":"right"},{"Var":"tree_case_74_0"},{"Var":"tree_case_74_1"},{"Var":"tree_case_74_2"},{"Var":"tree_case_74_3"},{"Var":"tree_case_74_4"},{"Var":"tree_case_74_5"},{"Var":"tree_case_77_0"},{"Var":"tree_case_77_1"},{"Var":"tree_case_77_2"},{"Var":"tree_case_77_3"},{"Var":"tree_case_77_4"},{"Var":"tree_case_77_5"}],"premises":[{"Hypothesis":0},{"Hypothesis":1},{"Hypothesis":2},{"Hypothesis":3},{"Hypothesis":4},{"Hypothesis":5}],"theorem":"e6bf73f7b6192bd23553a508712ea025a084d5377320268e456bca5883de6748"}}],"theorem":"ecb5f0fe765c23cab036dab5aeb85724371c831e3e4d63eb81588998f75d7798"}},"variable":"tree_proof_hole"}}]},"to":{"Bool":true}}}},"schema":1,"semantics":"first-order-inductive-equality-v1"}
