{"dependencies":["18e84eab07c91c68fcfef365105156492ed923514972942965d506d59bf27e5a","4c3359113b8476afb07c623c49d2bb57487e0f388609f2111ab0103adcbd7fe6","5e43b5c105efacfdf935b54f8701cebf3674d19451fc2ab6f85d8884f1f6117c","985b1d3a3ef84acfec5b04cc0e97f02e37a90a94531f2d44e70441b065ddbfc7","aa4b4d10ded23af26918448553b80f26334c687b7cd335992439f98655348d79","ade150fd8ed7b5b69f3cf01969b73ebc324ef8f93b6c477e1d689d88bfa4bdf9","b8b70ac79f10e9d48f64ae5b9b8bed9e087b35a3f7256813c98df4f783dfecd6","bdc38dcc7fa6ea9ed6c270fe78680793965be480ec5e0eea41136eba8dc218fe","c12231e9fa0f02135491772f8d3f3ace10d8b9d1d5c3ea70dc152db403f8249e","ddd2014acc147fd2466912ac6e0d88d01968724066460083896586da77415146","e66ab993ade255a3f7a1d5d0f2afc01ae46054686cdff91ea86a6fae24331f13","ede44dcc7c284e4f7057eea0c0be788c9bc3c0229fb607c58dc92f41d20edf49"],"interface":{"conditions":[],"effects":[],"operations":[],"parameters":{"traverse_rows":{"Data":"bdc38dcc7fa6ea9ed6c270fe78680793965be480ec5e0eea41136eba8dc218fe"}},"result":{"Data":"bdc38dcc7fa6ea9ed6c270fe78680793965be480ec5e0eea41136eba8dc218fe"}},"kind":"definition","payload":{"declaration":{"Function":{"body":{"Match":{"branches":[{"bindings":[],"body":{"Construct":{"arguments":[],"constructor":0,"datatype":"bdc38dcc7fa6ea9ed6c270fe78680793965be480ec5e0eea41136eba8dc218fe"}}},{"bindings":["traverse_head","traverse_tail"],"body":{"If":{"condition":{"Match":{"branches":[{"bindings":["model_61","model_62","model_63"],"body":{"Var":"model_63"}}],"scrutinee":{"Var":"traverse_head"}}},"on_false":{"SelfCall":[{"Var":"traverse_tail"}]},"on_true":{"Construct":{"arguments":[{"Var":"traverse_head"},{"SelfCall":[{"Var":"traverse_tail"}]}],"constructor":1,"datatype":"bdc38dcc7fa6ea9ed6c270fe78680793965be480ec5e0eea41136eba8dc218fe"}}}}}],"scrutinee":{"Var":"traverse_rows"}}},"params":[["traverse_rows",{"Data":"bdc38dcc7fa6ea9ed6c270fe78680793965be480ec5e0eea41136eba8dc218fe"}]],"recursive":0,"result":{"Data":"bdc38dcc7fa6ea9ed6c270fe78680793965be480ec5e0eea41136eba8dc218fe"}}}},"schema":1,"semantics":"first-order-inductive-equality-v1"}
