{"dependencies":["0c44e7a5924949ef4be3f74a88ac769056679cbd1044d51c55b5811c209db23e","128fc930ccf41033270e2cf4035a565b3f379fd2f832190bc6da2cdc81517708","18e84eab07c91c68fcfef365105156492ed923514972942965d506d59bf27e5a","1c3399f72405adf5f8995d621f0c490f85412137ce32d0ae8c4d35ba646a8440","229f5da6fe5911a65a7a746debc49a69dd5d017523342f5dd17cd81925af6f9e","23f04b27c737dcfbef2ad51aca65d6554fb5fcf0124a7415b384c9fbe0e67613","2b176851f6252cdb33dc8eca46896a90b915bb68631601b230e4eea2ae2b2068","431bf715934b9480c7d9096730aaf1b7d18e74d31d28ab1a994e8e0cc082e379","5e43b5c105efacfdf935b54f8701cebf3674d19451fc2ab6f85d8884f1f6117c","60a5764f00d632c4513f33b23a4e389c5dfc8ff8f93bcc7056be5e83a37ab109","614aa32311cffd84621d040de21feaf9664558ece6e1ca76ca0c210fe950a8a9","66496c1b0e3c5dec09aa13fa726d83fa5aafe93fe06cab9657a50530537e0494","6f5098c4226d33473b51c00c067abf0010658eb16f99306e7ac9fb7ee88e7a31","9c900b60fd87699585726d5e9a110ef7e116f9b9169d54b6db7104c1a74af2fd","ade150fd8ed7b5b69f3cf01969b73ebc324ef8f93b6c477e1d689d88bfa4bdf9","c12231e9fa0f02135491772f8d3f3ace10d8b9d1d5c3ea70dc152db403f8249e","c2e1e03b8a26eef92bdda35af891d1f0d033565e90c17f935d819584ee0491a5","d09bf43453f100816a60694f2c532e721de965c45716ae4564f2c2eaaf0f7c2f","d40747354b5c8feb90acf7f6fcffed59198bc80764a2e27ce0578d17a1e64631","d611d48b1d32a109dc93883a2a8923a76a7d92adbabcb2c682a92d8ef30985d8","ed3228ffda95e20181a83e246b5851d38bafca79dca82a82fec2b45e37d3aa90","f015abc2f341ae2e1298aafd99d4022be248977c55f961b452878c729d2613b0","f05183b3c7a3a7aaf4ca3228a3a055bca781683d3a285a342755a8a570a9fa90"],"interface":{"conditions":[],"effects":[],"operations":["binary:+","binary:-"],"parameters":{"word_0":"U64","word_1":"U64","word_2":"U64","word_3":"U64"},"result":null},"kind":"theorem","payload":{"declaration":{"Theorem":{"conditions":[],"from":{"Binary":{"left":{"Var":"word_1"},"op":"+","right":{"Binary":{"left":{"Var":"word_3"},"op":"+","right":{"Binary":{"left":{"Var":"word_0"},"op":"+","right":{"Binary":{"left":{"Var":"word_2"},"op":"+","right":{"Binary":{"left":{"U64":0},"op":"-","right":{"Var":"word_3"}}}}}}}}}}},"params":[["word_0","U64"],["word_1","U64"],["word_2","U64"],["word_3","U64"]],"proof":{"Trans":[{"Use":{"arguments":[{"Var":"word_0"},{"Var":"word_1"},{"Var":"word_2"},{"Var":"word_3"}],"premises":[],"theorem":"0c44e7a5924949ef4be3f74a88ac769056679cbd1044d51c55b5811c209db23e"}},{"Binary":{"left":{"Refl":{"Var":"word_0"}},"op":"+","right":{"Binary":{"left":{"Refl":{"Var":"word_1"}},"op":"+","right":{"Binary":{"left":{"Refl":{"Var":"word_2"}},"op":"+","right":{"Use":{"arguments":[{"Var":"word_3"}],"premises":[],"theorem":"1c3399f72405adf5f8995d621f0c490f85412137ce32d0ae8c4d35ba646a8440"}}}}}}}}]},"to":{"Binary":{"left":{"Var":"word_0"},"op":"+","right":{"Binary":{"left":{"Var":"word_1"},"op":"+","right":{"Binary":{"left":{"Var":"word_2"},"op":"+","right":{"U64":0}}}}}}}}}},"schema":1,"semantics":"first-order-inductive-equality-v1"}
