{"dependencies":["38cae3e98f3eed1778882b4c5d6ccd78a2dcd29b1d57d40d9eb4e6665ed5d52f","3bfd71913a96ad9512901f6734ca5cd2fd967edf57130ed015fdb1b384bcd7ad","457dc329cc9179fc67d53dd5ad504cba9495f603dff7e2238faece0cbeb16ede","623885d122fb8f1a0e5f6dae96c71d19d96fbbde220312c01fd88daafbad5cee","6bc9cae150bb03674803b216374db6f3c1732ddd4e7dc088fd21056c84e6f658","6c9efc7cee62903e012b7b63ac0f516956950eca03c8cb4f0d05c2bbf5d9b53c","8cec548bbc3a690bd52bdf434f7df2bb7e3c5601125c2677c5d01e1f8a95cf5b","9b2300f15c1f482f118af175638ba983fefa89b0ede6b02bbccb9c51aba593ad","af255cddcfb8e0b31b2792099593ce3916db30d0d49bf251c4c4754f61920b34","bd4b65fd5a8087237ea35c9bb4711c70fc63338b07fb79b103eff79b0c7cce91","e5f61ad93af004043b8ff94b0a1accdb996df550102461885e7e67f5b405b1ce"],"interface":{"conditions":[{"from":{"Call":{"arguments":[{"Call":{"arguments":[{"Var":"left"},{"Var":"side_left"}],"function":"38cae3e98f3eed1778882b4c5d6ccd78a2dcd29b1d57d40d9eb4e6665ed5d52f"}}],"function":"3bfd71913a96ad9512901f6734ca5cd2fd967edf57130ed015fdb1b384bcd7ad"}},"to":{"Call":{"arguments":[{"Call":{"arguments":[{"Var":"left"}],"function":"3bfd71913a96ad9512901f6734ca5cd2fd967edf57130ed015fdb1b384bcd7ad"}},{"Call":{"arguments":[{"Var":"side_left"}],"function":"3bfd71913a96ad9512901f6734ca5cd2fd967edf57130ed015fdb1b384bcd7ad"}}],"function":"e5f61ad93af004043b8ff94b0a1accdb996df550102461885e7e67f5b405b1ce"}}},{"from":{"Call":{"arguments":[{"Call":{"arguments":[{"Var":"left"},{"Var":"side_right"}],"function":"38cae3e98f3eed1778882b4c5d6ccd78a2dcd29b1d57d40d9eb4e6665ed5d52f"}}],"function":"3bfd71913a96ad9512901f6734ca5cd2fd967edf57130ed015fdb1b384bcd7ad"}},"to":{"Call":{"arguments":[{"Call":{"arguments":[{"Var":"left"}],"function":"3bfd71913a96ad9512901f6734ca5cd2fd967edf57130ed015fdb1b384bcd7ad"}},{"Call":{"arguments":[{"Var":"side_right"}],"function":"3bfd71913a96ad9512901f6734ca5cd2fd967edf57130ed015fdb1b384bcd7ad"}}],"function":"e5f61ad93af004043b8ff94b0a1accdb996df550102461885e7e67f5b405b1ce"}}}],"effects":[],"operations":["binary:+","binary:>","call:38cae3e98f3eed1778882b4c5d6ccd78a2dcd29b1d57d40d9eb4e6665ed5d52f","call:3bfd71913a96ad9512901f6734ca5cd2fd967edf57130ed015fdb1b384bcd7ad","call:6bc9cae150bb03674803b216374db6f3c1732ddd4e7dc088fd21056c84e6f658","call:9b2300f15c1f482f118af175638ba983fefa89b0ede6b02bbccb9c51aba593ad","call:e5f61ad93af004043b8ff94b0a1accdb996df550102461885e7e67f5b405b1ce"],"parameters":{"left":{"Data":"bd4b65fd5a8087237ea35c9bb4711c70fc63338b07fb79b103eff79b0c7cce91"},"side_count":"U64","side_height":"U64","side_hi":{"Data":"623885d122fb8f1a0e5f6dae96c71d19d96fbbde220312c01fd88daafbad5cee"},"side_left":{"Data":"bd4b65fd5a8087237ea35c9bb4711c70fc63338b07fb79b103eff79b0c7cce91"},"side_lo":{"Data":"623885d122fb8f1a0e5f6dae96c71d19d96fbbde220312c01fd88daafbad5cee"},"side_right":{"Data":"bd4b65fd5a8087237ea35c9bb4711c70fc63338b07fb79b103eff79b0c7cce91"},"side_sum":{"Data":"457dc329cc9179fc67d53dd5ad504cba9495f603dff7e2238faece0cbeb16ede"}},"result":null},"kind":"theorem","payload":{"declaration":{"Theorem":{"conditions":[{"from":{"Call":{"arguments":[{"Call":{"arguments":[{"Var":"left"},{"Var":"side_left"}],"function":"38cae3e98f3eed1778882b4c5d6ccd78a2dcd29b1d57d40d9eb4e6665ed5d52f"}}],"function":"3bfd71913a96ad9512901f6734ca5cd2fd967edf57130ed015fdb1b384bcd7ad"}},"to":{"Call":{"arguments":[{"Call":{"arguments":[{"Var":"left"}],"function":"3bfd71913a96ad9512901f6734ca5cd2fd967edf57130ed015fdb1b384bcd7ad"}},{"Call":{"arguments":[{"Var":"side_left"}],"function":"3bfd71913a96ad9512901f6734ca5cd2fd967edf57130ed015fdb1b384bcd7ad"}}],"function":"e5f61ad93af004043b8ff94b0a1accdb996df550102461885e7e67f5b405b1ce"}}},{"from":{"Call":{"arguments":[{"Call":{"arguments":[{"Var":"left"},{"Var":"side_right"}],"function":"38cae3e98f3eed1778882b4c5d6ccd78a2dcd29b1d57d40d9eb4e6665ed5d52f"}}],"function":"3bfd71913a96ad9512901f6734ca5cd2fd967edf57130ed015fdb1b384bcd7ad"}},"to":{"Call":{"arguments":[{"Call":{"arguments":[{"Var":"left"}],"function":"3bfd71913a96ad9512901f6734ca5cd2fd967edf57130ed015fdb1b384bcd7ad"}},{"Call":{"arguments":[{"Var":"side_right"}],"function":"3bfd71913a96ad9512901f6734ca5cd2fd967edf57130ed015fdb1b384bcd7ad"}}],"function":"e5f61ad93af004043b8ff94b0a1accdb996df550102461885e7e67f5b405b1ce"}}}],"from":{"If":{"condition":{"Binary":{"left":{"Call":{"arguments":[{"Construct":{"arguments":[{"Var":"side_left"},{"Var":"side_right"},{"Var":"side_lo"},{"Var":"side_hi"},{"Var":"side_sum"},{"Var":"side_count"},{"Var":"side_height"}],"constructor":2,"datatype":"bd4b65fd5a8087237ea35c9bb4711c70fc63338b07fb79b103eff79b0c7cce91"}}],"function":"6bc9cae150bb03674803b216374db6f3c1732ddd4e7dc088fd21056c84e6f658"}},"op":">","right":{"Binary":{"left":{"Call":{"arguments":[{"Var":"left"}],"function":"6bc9cae150bb03674803b216374db6f3c1732ddd4e7dc088fd21056c84e6f658"}},"op":"+","right":{"U64":1}}}}},"on_false":{"Call":{"arguments":[{"Call":{"arguments":[{"Var":"left"},{"Construct":{"arguments":[{"Var":"side_left"},{"Var":"side_right"},{"Var":"side_lo"},{"Var":"side_hi"},{"Var":"side_sum"},{"Var":"side_count"},{"Var":"side_height"}],"constructor":2,"datatype":"bd4b65fd5a8087237ea35c9bb4711c70fc63338b07fb79b103eff79b0c7cce91"}}],"function":"9b2300f15c1f482f118af175638ba983fefa89b0ede6b02bbccb9c51aba593ad"}}],"function":"3bfd71913a96ad9512901f6734ca5cd2fd967edf57130ed015fdb1b384bcd7ad"}},"on_true":{"Call":{"arguments":[{"Call":{"arguments":[{"Var":"left"}],"function":"3bfd71913a96ad9512901f6734ca5cd2fd967edf57130ed015fdb1b384bcd7ad"}},{"Call":{"arguments":[{"Construct":{"arguments":[{"Var":"side_left"},{"Var":"side_right"},{"Var":"side_lo"},{"Var":"side_hi"},{"Var":"side_sum"},{"Var":"side_count"},{"Var":"side_height"}],"constructor":2,"datatype":"bd4b65fd5a8087237ea35c9bb4711c70fc63338b07fb79b103eff79b0c7cce91"}}],"function":"3bfd71913a96ad9512901f6734ca5cd2fd967edf57130ed015fdb1b384bcd7ad"}}],"function":"e5f61ad93af004043b8ff94b0a1accdb996df550102461885e7e67f5b405b1ce"}}}},"params":[["left",{"Data":"bd4b65fd5a8087237ea35c9bb4711c70fc63338b07fb79b103eff79b0c7cce91"}],["side_left",{"Data":"bd4b65fd5a8087237ea35c9bb4711c70fc63338b07fb79b103eff79b0c7cce91"}],["side_right",{"Data":"bd4b65fd5a8087237ea35c9bb4711c70fc63338b07fb79b103eff79b0c7cce91"}],["side_lo",{"Data":"623885d122fb8f1a0e5f6dae96c71d19d96fbbde220312c01fd88daafbad5cee"}],["side_hi",{"Data":"623885d122fb8f1a0e5f6dae96c71d19d96fbbde220312c01fd88daafbad5cee"}],["side_sum",{"Data":"457dc329cc9179fc67d53dd5ad504cba9495f603dff7e2238faece0cbeb16ede"}],["side_count","U64"],["side_height","U64"]],"proof":{"Substitute":{"context":{"If":{"condition":{"Binary":{"left":{"Call":{"arguments":[{"Construct":{"arguments":[{"Var":"side_left"},{"Var":"side_right"},{"Var":"side_lo"},{"Var":"side_hi"},{"Var":"side_sum"},{"Var":"side_count"},{"Var":"side_height"}],"constructor":2,"datatype":"bd4b65fd5a8087237ea35c9bb4711c70fc63338b07fb79b103eff79b0c7cce91"}}],"function":"6bc9cae150bb03674803b216374db6f3c1732ddd4e7dc088fd21056c84e6f658"}},"op":">","right":{"Binary":{"left":{"Call":{"arguments":[{"Var":"left"}],"function":"6bc9cae150bb03674803b216374db6f3c1732ddd4e7dc088fd21056c84e6f658"}},"op":"+","right":{"U64":1}}}}},"on_false":{"Var":"prune_hole"},"on_true":{"Call":{"arguments":[{"Call":{"arguments":[{"Var":"left"}],"function":"3bfd71913a96ad9512901f6734ca5cd2fd967edf57130ed015fdb1b384bcd7ad"}},{"Call":{"arguments":[{"Construct":{"arguments":[{"Var":"side_left"},{"Var":"side_right"},{"Var":"side_lo"},{"Var":"side_hi"},{"Var":"side_sum"},{"Var":"side_count"},{"Var":"side_height"}],"constructor":2,"datatype":"bd4b65fd5a8087237ea35c9bb4711c70fc63338b07fb79b103eff79b0c7cce91"}}],"function":"3bfd71913a96ad9512901f6734ca5cd2fd967edf57130ed015fdb1b384bcd7ad"}}],"function":"e5f61ad93af004043b8ff94b0a1accdb996df550102461885e7e67f5b405b1ce"}}}},"equality":{"Use":{"arguments":[{"Var":"left"},{"Var":"side_left"},{"Var":"side_right"},{"Var":"side_lo"},{"Var":"side_hi"},{"Var":"side_sum"},{"Var":"side_count"},{"Var":"side_height"}],"premises":[{"Hypothesis":0},{"Hypothesis":1}],"theorem":"af255cddcfb8e0b31b2792099593ce3916db30d0d49bf251c4c4754f61920b34"}},"variable":"prune_hole"}},"to":{"If":{"condition":{"Binary":{"left":{"Call":{"arguments":[{"Construct":{"arguments":[{"Var":"side_left"},{"Var":"side_right"},{"Var":"side_lo"},{"Var":"side_hi"},{"Var":"side_sum"},{"Var":"side_count"},{"Var":"side_height"}],"constructor":2,"datatype":"bd4b65fd5a8087237ea35c9bb4711c70fc63338b07fb79b103eff79b0c7cce91"}}],"function":"6bc9cae150bb03674803b216374db6f3c1732ddd4e7dc088fd21056c84e6f658"}},"op":">","right":{"Binary":{"left":{"Call":{"arguments":[{"Var":"left"}],"function":"6bc9cae150bb03674803b216374db6f3c1732ddd4e7dc088fd21056c84e6f658"}},"op":"+","right":{"U64":1}}}}},"on_false":{"Call":{"arguments":[{"Call":{"arguments":[{"Var":"left"}],"function":"3bfd71913a96ad9512901f6734ca5cd2fd967edf57130ed015fdb1b384bcd7ad"}},{"Call":{"arguments":[{"Construct":{"arguments":[{"Var":"side_left"},{"Var":"side_right"},{"Var":"side_lo"},{"Var":"side_hi"},{"Var":"side_sum"},{"Var":"side_count"},{"Var":"side_height"}],"constructor":2,"datatype":"bd4b65fd5a8087237ea35c9bb4711c70fc63338b07fb79b103eff79b0c7cce91"}}],"function":"3bfd71913a96ad9512901f6734ca5cd2fd967edf57130ed015fdb1b384bcd7ad"}}],"function":"e5f61ad93af004043b8ff94b0a1accdb996df550102461885e7e67f5b405b1ce"}},"on_true":{"Call":{"arguments":[{"Call":{"arguments":[{"Var":"left"}],"function":"3bfd71913a96ad9512901f6734ca5cd2fd967edf57130ed015fdb1b384bcd7ad"}},{"Call":{"arguments":[{"Construct":{"arguments":[{"Var":"side_left"},{"Var":"side_right"},{"Var":"side_lo"},{"Var":"side_hi"},{"Var":"side_sum"},{"Var":"side_count"},{"Var":"side_height"}],"constructor":2,"datatype":"bd4b65fd5a8087237ea35c9bb4711c70fc63338b07fb79b103eff79b0c7cce91"}}],"function":"3bfd71913a96ad9512901f6734ca5cd2fd967edf57130ed015fdb1b384bcd7ad"}}],"function":"e5f61ad93af004043b8ff94b0a1accdb996df550102461885e7e67f5b405b1ce"}}}}}}},"schema":1,"semantics":"first-order-inductive-equality-v1"}
