{"dependencies":["278f96199151750d38923eeddb65a2c9b439d8b9d36ae2f7f74c9045f0fffb08","34930b2cdb913d8e634be4fa38872eb83d9514e3627f7ff602263bb911925cb4","370d000618c2ca958975b0047df3365db8d5141cec831578ae59138e6f279a06","3973800fa96d6e3a59e2564a2aaa0b33466c14748573902474f95e3b90101b15","4d9946ad9a037d55daebbf6b4f332ecf1e985eca512336e0f0bb06e1d923e74d","69e8f0462123beaac5b725c965920b8c2340af30429b47d726fe1fc20b333fba","70e688e22d70f509933d86798827545906a33c9094356ad2715da19f9a858186","782628ab95dd828a24fb4b442e55f58436200200a31424ec2d88eeac2d8957ac","79600f1417d2f4c6b85b3e7f6dae2961fd4cb831fc27c7d1b2cbdc35bf201019","92368800572ebbcfe203c07e2d7e7e00d60743f84b2b815a526d470566792f7f","9d8945d011aad39bd2cbae26176ba49ac968ead2dd1578b57377544dd87b74ba","a30c0ace3df642a1b8bb987b0b4d92e42f1f5989252275039eac2b19b8e2f8cf","baa9fb170ac2322a5cbf5fab9c84873a889f82bfd5054af51e8177bfc756899c","c6927b0865f87bb196f15f68b8badb81fa1be85d4df74ec9dc19dc46fb41576b","f27adec85821cbe8b99f7bc2f162d97850e36e621f2d648920a59601eda91273"],"interface":{"conditions":[{"from":{"Var":"arg_1"},"to":{"Bool":true}}],"effects":[],"operations":["binary:+","binary:==","call:3973800fa96d6e3a59e2564a2aaa0b33466c14748573902474f95e3b90101b15","call:4d9946ad9a037d55daebbf6b4f332ecf1e985eca512336e0f0bb06e1d923e74d","call:69e8f0462123beaac5b725c965920b8c2340af30429b47d726fe1fc20b333fba","call:79600f1417d2f4c6b85b3e7f6dae2961fd4cb831fc27c7d1b2cbdc35bf201019","call:a30c0ace3df642a1b8bb987b0b4d92e42f1f5989252275039eac2b19b8e2f8cf"],"parameters":{"arg_0":"U64","arg_1":"Bool","indexed_tree":{"Data":"9d8945d011aad39bd2cbae26176ba49ac968ead2dd1578b57377544dd87b74ba"},"version":"U64"},"result":null},"kind":"theorem","payload":{"declaration":{"Theorem":{"conditions":[{"from":{"Var":"arg_1"},"to":{"Bool":true}}],"from":{"Call":{"arguments":[{"Call":{"arguments":[{"Call":{"arguments":[{"Call":{"arguments":[{"Construct":{"arguments":[{"Call":{"arguments":[{"Var":"indexed_tree"}],"function":"3973800fa96d6e3a59e2564a2aaa0b33466c14748573902474f95e3b90101b15"}}],"constructor":0,"datatype":"34930b2cdb913d8e634be4fa38872eb83d9514e3627f7ff602263bb911925cb4"}},{"Var":"version"},{"Var":"arg_0"},{"Var":"arg_1"}],"function":"a30c0ace3df642a1b8bb987b0b4d92e42f1f5989252275039eac2b19b8e2f8cf"}}],"function":"4d9946ad9a037d55daebbf6b4f332ecf1e985eca512336e0f0bb06e1d923e74d"}}],"function":"79600f1417d2f4c6b85b3e7f6dae2961fd4cb831fc27c7d1b2cbdc35bf201019"}}],"function":"3973800fa96d6e3a59e2564a2aaa0b33466c14748573902474f95e3b90101b15"}},"params":[["indexed_tree",{"Data":"9d8945d011aad39bd2cbae26176ba49ac968ead2dd1578b57377544dd87b74ba"}],["version","U64"],["arg_0","U64"],["arg_1","Bool"]],"proof":{"Trans":[{"Convert":{"from":{"Call":{"arguments":[{"Call":{"arguments":[{"Call":{"arguments":[{"Call":{"arguments":[{"Construct":{"arguments":[{"Call":{"arguments":[{"Var":"indexed_tree"}],"function":"3973800fa96d6e3a59e2564a2aaa0b33466c14748573902474f95e3b90101b15"}}],"constructor":0,"datatype":"34930b2cdb913d8e634be4fa38872eb83d9514e3627f7ff602263bb911925cb4"}},{"Var":"version"},{"Var":"arg_0"},{"Var":"arg_1"}],"function":"a30c0ace3df642a1b8bb987b0b4d92e42f1f5989252275039eac2b19b8e2f8cf"}}],"function":"4d9946ad9a037d55daebbf6b4f332ecf1e985eca512336e0f0bb06e1d923e74d"}}],"function":"79600f1417d2f4c6b85b3e7f6dae2961fd4cb831fc27c7d1b2cbdc35bf201019"}}],"function":"3973800fa96d6e3a59e2564a2aaa0b33466c14748573902474f95e3b90101b15"}},"to":{"Call":{"arguments":[{"Match":{"branches":[{"bindings":["physical_tree"],"body":{"Var":"physical_tree"}}],"scrutinee":{"Match":{"branches":[{"bindings":["unused_binding_0_0","unused_binding_1_0","unused_binding_2_0","observed_state","unused_binding_4_0"],"body":{"Var":"observed_state"}},{"bindings":["unused_binding_0_0","unused_binding_1_0","observed_state"],"body":{"Var":"observed_state"}}],"scrutinee":{"If":{"condition":{"Var":"arg_1"},"on_false":{"If":{"condition":{"Binary":{"left":{"Var":"version"},"op":"==","right":{"U64":18446744073709551615}}},"on_false":{"Construct":{"arguments":[{"Construct":{"arguments":[{"Construct":{"arguments":[],"constructor":0,"datatype":"baa9fb170ac2322a5cbf5fab9c84873a889f82bfd5054af51e8177bfc756899c"}}],"constructor":0,"datatype":"92368800572ebbcfe203c07e2d7e7e00d60743f84b2b815a526d470566792f7f"}},{"Bool":true},{"Binary":{"left":{"Var":"version"},"op":"+","right":{"U64":1}}},{"Construct":{"arguments":[{"Call":{"arguments":[{"Call":{"arguments":[{"Var":"indexed_tree"}],"function":"3973800fa96d6e3a59e2564a2aaa0b33466c14748573902474f95e3b90101b15"}},{"Var":"arg_0"}],"function":"69e8f0462123beaac5b725c965920b8c2340af30429b47d726fe1fc20b333fba"}}],"constructor":0,"datatype":"34930b2cdb913d8e634be4fa38872eb83d9514e3627f7ff602263bb911925cb4"}},{"Construct":{"arguments":[{"Construct":{"arguments":[{"Var":"arg_0"}],"constructor":0,"datatype":"278f96199151750d38923eeddb65a2c9b439d8b9d36ae2f7f74c9045f0fffb08"}},{"Construct":{"arguments":[],"constructor":0,"datatype":"70e688e22d70f509933d86798827545906a33c9094356ad2715da19f9a858186"}}],"constructor":1,"datatype":"70e688e22d70f509933d86798827545906a33c9094356ad2715da19f9a858186"}}],"constructor":0,"datatype":"370d000618c2ca958975b0047df3365db8d5141cec831578ae59138e6f279a06"}},"on_true":{"Construct":{"arguments":[{"U64":1},{"Var":"version"},{"Construct":{"arguments":[{"Call":{"arguments":[{"Var":"indexed_tree"}],"function":"3973800fa96d6e3a59e2564a2aaa0b33466c14748573902474f95e3b90101b15"}}],"constructor":0,"datatype":"34930b2cdb913d8e634be4fa38872eb83d9514e3627f7ff602263bb911925cb4"}}],"constructor":1,"datatype":"370d000618c2ca958975b0047df3365db8d5141cec831578ae59138e6f279a06"}}}},"on_true":{"Construct":{"arguments":[{"Construct":{"arguments":[{"Construct":{"arguments":[],"constructor":0,"datatype":"c6927b0865f87bb196f15f68b8badb81fa1be85d4df74ec9dc19dc46fb41576b"}}],"constructor":1,"datatype":"92368800572ebbcfe203c07e2d7e7e00d60743f84b2b815a526d470566792f7f"}},{"Bool":false},{"Var":"version"},{"Construct":{"arguments":[{"Call":{"arguments":[{"Var":"indexed_tree"}],"function":"3973800fa96d6e3a59e2564a2aaa0b33466c14748573902474f95e3b90101b15"}}],"constructor":0,"datatype":"34930b2cdb913d8e634be4fa38872eb83d9514e3627f7ff602263bb911925cb4"}},{"Construct":{"arguments":[],"constructor":0,"datatype":"70e688e22d70f509933d86798827545906a33c9094356ad2715da19f9a858186"}}],"constructor":0,"datatype":"370d000618c2ca958975b0047df3365db8d5141cec831578ae59138e6f279a06"}}}}}}}}],"function":"3973800fa96d6e3a59e2564a2aaa0b33466c14748573902474f95e3b90101b15"}}}},{"Use":{"arguments":[{"Var":"indexed_tree"},{"Var":"version"},{"Var":"arg_0"},{"Var":"arg_1"}],"premises":[{"Hypothesis":0}],"theorem":"f27adec85821cbe8b99f7bc2f162d97850e36e621f2d648920a59601eda91273"}}]},"to":{"Call":{"arguments":[{"Match":{"branches":[{"bindings":["physical_tree"],"body":{"Var":"physical_tree"}}],"scrutinee":{"Match":{"branches":[{"bindings":["unused_binding_0_0","unused_binding_1_0","unused_binding_2_0","observed_state","unused_binding_4_0"],"body":{"Var":"observed_state"}},{"bindings":["unused_binding_0_0","unused_binding_1_0","observed_state"],"body":{"Var":"observed_state"}}],"scrutinee":{"If":{"condition":{"Bool":true},"on_false":{"If":{"condition":{"Binary":{"left":{"Var":"version"},"op":"==","right":{"U64":18446744073709551615}}},"on_false":{"Construct":{"arguments":[{"Construct":{"arguments":[{"Construct":{"arguments":[],"constructor":0,"datatype":"baa9fb170ac2322a5cbf5fab9c84873a889f82bfd5054af51e8177bfc756899c"}}],"constructor":0,"datatype":"92368800572ebbcfe203c07e2d7e7e00d60743f84b2b815a526d470566792f7f"}},{"Bool":true},{"Binary":{"left":{"Var":"version"},"op":"+","right":{"U64":1}}},{"Construct":{"arguments":[{"Call":{"arguments":[{"Call":{"arguments":[{"Var":"indexed_tree"}],"function":"3973800fa96d6e3a59e2564a2aaa0b33466c14748573902474f95e3b90101b15"}},{"Var":"arg_0"}],"function":"69e8f0462123beaac5b725c965920b8c2340af30429b47d726fe1fc20b333fba"}}],"constructor":0,"datatype":"34930b2cdb913d8e634be4fa38872eb83d9514e3627f7ff602263bb911925cb4"}},{"Construct":{"arguments":[{"Construct":{"arguments":[{"Var":"arg_0"}],"constructor":0,"datatype":"278f96199151750d38923eeddb65a2c9b439d8b9d36ae2f7f74c9045f0fffb08"}},{"Construct":{"arguments":[],"constructor":0,"datatype":"70e688e22d70f509933d86798827545906a33c9094356ad2715da19f9a858186"}}],"constructor":1,"datatype":"70e688e22d70f509933d86798827545906a33c9094356ad2715da19f9a858186"}}],"constructor":0,"datatype":"370d000618c2ca958975b0047df3365db8d5141cec831578ae59138e6f279a06"}},"on_true":{"Construct":{"arguments":[{"U64":1},{"Var":"version"},{"Construct":{"arguments":[{"Call":{"arguments":[{"Var":"indexed_tree"}],"function":"3973800fa96d6e3a59e2564a2aaa0b33466c14748573902474f95e3b90101b15"}}],"constructor":0,"datatype":"34930b2cdb913d8e634be4fa38872eb83d9514e3627f7ff602263bb911925cb4"}}],"constructor":1,"datatype":"370d000618c2ca958975b0047df3365db8d5141cec831578ae59138e6f279a06"}}}},"on_true":{"Construct":{"arguments":[{"Construct":{"arguments":[{"Construct":{"arguments":[],"constructor":0,"datatype":"c6927b0865f87bb196f15f68b8badb81fa1be85d4df74ec9dc19dc46fb41576b"}}],"constructor":1,"datatype":"92368800572ebbcfe203c07e2d7e7e00d60743f84b2b815a526d470566792f7f"}},{"Bool":false},{"Var":"version"},{"Construct":{"arguments":[{"Call":{"arguments":[{"Var":"indexed_tree"}],"function":"3973800fa96d6e3a59e2564a2aaa0b33466c14748573902474f95e3b90101b15"}}],"constructor":0,"datatype":"34930b2cdb913d8e634be4fa38872eb83d9514e3627f7ff602263bb911925cb4"}},{"Construct":{"arguments":[],"constructor":0,"datatype":"70e688e22d70f509933d86798827545906a33c9094356ad2715da19f9a858186"}}],"constructor":0,"datatype":"370d000618c2ca958975b0047df3365db8d5141cec831578ae59138e6f279a06"}}}}}}}}],"function":"3973800fa96d6e3a59e2564a2aaa0b33466c14748573902474f95e3b90101b15"}}}}},"schema":1,"semantics":"first-order-inductive-equality-v1"}
