{"dependencies":["1b2526b8ef57ce6671657155716f8c663d67ba02f94f95e97b485191614de8fb","33bd44766bef76516e9c4079c5c7540cce5a4db5e6bbdde5505e36ca2e27a023","7cc9b1f30bd0585ff26fde9d7092b26a24d22a6f15c0ce8b971878a9311cc642","8cec548bbc3a690bd52bdf434f7df2bb7e3c5601125c2677c5d01e1f8a95cf5b","bae3de734813acec4e80b77afd3a907942956675e2214d34d6130dd91d218e5d"],"interface":{"conditions":[],"effects":[],"operations":["binary:<","call:1b2526b8ef57ce6671657155716f8c663d67ba02f94f95e97b485191614de8fb","call:33bd44766bef76516e9c4079c5c7540cce5a4db5e6bbdde5505e36ca2e27a023"],"parameters":{"a":{"Data":"bae3de734813acec4e80b77afd3a907942956675e2214d34d6130dd91d218e5d"},"b":{"Data":"bae3de734813acec4e80b77afd3a907942956675e2214d34d6130dd91d218e5d"},"c":{"Data":"bae3de734813acec4e80b77afd3a907942956675e2214d34d6130dd91d218e5d"}},"result":{"Data":"bae3de734813acec4e80b77afd3a907942956675e2214d34d6130dd91d218e5d"}},"kind":"definition","payload":{"declaration":{"Function":{"body":{"If":{"condition":{"Binary":{"left":{"Call":{"arguments":[{"Var":"c"}],"function":"33bd44766bef76516e9c4079c5c7540cce5a4db5e6bbdde5505e36ca2e27a023"}},"op":"<","right":{"Call":{"arguments":[{"Var":"b"}],"function":"33bd44766bef76516e9c4079c5c7540cce5a4db5e6bbdde5505e36ca2e27a023"}}}},"on_false":{"Call":{"arguments":[{"Call":{"arguments":[{"Var":"a"},{"Var":"b"}],"function":"1b2526b8ef57ce6671657155716f8c663d67ba02f94f95e97b485191614de8fb"}},{"Var":"c"}],"function":"1b2526b8ef57ce6671657155716f8c663d67ba02f94f95e97b485191614de8fb"}},"on_true":{"Match":{"branches":[{"bindings":[],"body":{"Call":{"arguments":[{"Call":{"arguments":[{"Var":"a"},{"Var":"b"}],"function":"1b2526b8ef57ce6671657155716f8c663d67ba02f94f95e97b485191614de8fb"}},{"Var":"c"}],"function":"1b2526b8ef57ce6671657155716f8c663d67ba02f94f95e97b485191614de8fb"}}},{"bindings":["rot_key","rot_row"],"body":{"Call":{"arguments":[{"Call":{"arguments":[{"Var":"a"},{"Var":"b"}],"function":"1b2526b8ef57ce6671657155716f8c663d67ba02f94f95e97b485191614de8fb"}},{"Var":"c"}],"function":"1b2526b8ef57ce6671657155716f8c663d67ba02f94f95e97b485191614de8fb"}}},{"bindings":["rot_left","rot_right","rot_lo","rot_hi","rot_sum","rot_count","rot_height"],"body":{"Call":{"arguments":[{"Call":{"arguments":[{"Var":"a"},{"Var":"rot_left"}],"function":"1b2526b8ef57ce6671657155716f8c663d67ba02f94f95e97b485191614de8fb"}},{"Call":{"arguments":[{"Var":"rot_right"},{"Var":"c"}],"function":"1b2526b8ef57ce6671657155716f8c663d67ba02f94f95e97b485191614de8fb"}}],"function":"1b2526b8ef57ce6671657155716f8c663d67ba02f94f95e97b485191614de8fb"}}}],"scrutinee":{"Var":"b"}}}}},"params":[["a",{"Data":"bae3de734813acec4e80b77afd3a907942956675e2214d34d6130dd91d218e5d"}],["b",{"Data":"bae3de734813acec4e80b77afd3a907942956675e2214d34d6130dd91d218e5d"}],["c",{"Data":"bae3de734813acec4e80b77afd3a907942956675e2214d34d6130dd91d218e5d"}]],"recursive":null,"result":{"Data":"bae3de734813acec4e80b77afd3a907942956675e2214d34d6130dd91d218e5d"}}}},"schema":1,"semantics":"first-order-inductive-equality-v1"}
