{"dependencies":["148cbc3c44bd7bab0610159dd7cfe3bf5239ae8f25378ac2ddaef9586aafdd99","3a8ed4bab52e5362ef4a67e60300121bae37a3ce3a755cb15fa2c2885a66ab41","3e653fce9da6e199d395a8ab10ddb3298dfcb49550b42b52f67240cda8fac7f4","4fc45c98fddeb33c4187fa3ab083e66f1ac165f51ffb81b1fb653f9f1b47bf37","d6d1e801a87644d4640ef43622b7f2bcd6d18ff24c0afcf9c0d8decb25c5b56a","f74c02101693c3f16a1af07159198421e555942c25e5c512f94c52253d72e082"],"interface":{"conditions":[],"effects":[],"operations":["binary:<"],"parameters":{"key":"U64","new":{"Data":"3e653fce9da6e199d395a8ab10ddb3298dfcb49550b42b52f67240cda8fac7f4"},"rows":{"Data":"d6d1e801a87644d4640ef43622b7f2bcd6d18ff24c0afcf9c0d8decb25c5b56a"}},"result":{"Data":"d6d1e801a87644d4640ef43622b7f2bcd6d18ff24c0afcf9c0d8decb25c5b56a"}},"kind":"definition","payload":{"declaration":{"Function":{"body":{"Match":{"branches":[{"bindings":[],"body":{"Construct":{"arguments":[{"Var":"key"},{"Var":"new"},{"Construct":{"arguments":[],"constructor":0,"datatype":"d6d1e801a87644d4640ef43622b7f2bcd6d18ff24c0afcf9c0d8decb25c5b56a"}}],"constructor":1,"datatype":"d6d1e801a87644d4640ef43622b7f2bcd6d18ff24c0afcf9c0d8decb25c5b56a"}}},{"bindings":["head","value","tail"],"body":{"If":{"condition":{"Binary":{"left":{"Var":"key"},"op":"<","right":{"Var":"head"}}},"on_false":{"Construct":{"arguments":[{"Var":"head"},{"Var":"value"},{"SelfCall":[{"Var":"tail"},{"Var":"key"},{"Var":"new"}]}],"constructor":1,"datatype":"d6d1e801a87644d4640ef43622b7f2bcd6d18ff24c0afcf9c0d8decb25c5b56a"}},"on_true":{"Construct":{"arguments":[{"Var":"key"},{"Var":"new"},{"Var":"rows"}],"constructor":1,"datatype":"d6d1e801a87644d4640ef43622b7f2bcd6d18ff24c0afcf9c0d8decb25c5b56a"}}}}}],"scrutinee":{"Var":"rows"}}},"params":[["rows",{"Data":"d6d1e801a87644d4640ef43622b7f2bcd6d18ff24c0afcf9c0d8decb25c5b56a"}],["key","U64"],["new",{"Data":"3e653fce9da6e199d395a8ab10ddb3298dfcb49550b42b52f67240cda8fac7f4"}]],"recursive":0,"result":{"Data":"d6d1e801a87644d4640ef43622b7f2bcd6d18ff24c0afcf9c0d8decb25c5b56a"}}}},"schema":1,"semantics":"first-order-inductive-equality-v1"}
