{"dependencies":[],"interface":{"conditions":[],"effects":[],"operations":["apply","call:__ink_construct_85d8ad15f74c2e043a8b42019ea3296084e3d9b1e9fad9317f5b5b7d16c1f807","field:valid","record:__ink_instance_db378b22f6e7a40315bf8af5a849210b0e4b4266827900b9077694137ed7b764"],"parameters":{"item":{"Value":"U32"}},"result":{"Value":"Bool"}},"kind":"rewrite","payload":{"conditions":[],"definition_context":{"definitions":{"__ink_construct_85d8ad15f74c2e043a8b42019ea3296084e3d9b1e9fad9317f5b5b7d16c1f807":{"definition":{"body":{"node":{"Op":["record:__ink_instance_db378b22f6e7a40315bf8af5a849210b0e4b4266827900b9077694137ed7b764",[{"node":{"Free":"__ink_field_0"},"sort":{"Value":"U32"}},{"node":{"Free":"__ink_field_1"},"sort":{"Value":"Bool"}}]]},"sort":{"Value":{"Named":"__ink_instance_db378b22f6e7a40315bf8af5a849210b0e4b4266827900b9077694137ed7b764"}}},"callees":{},"params":[["__ink_field_0","U32"],["__ink_field_1","Bool"]],"result":{"Named":"__ink_instance_db378b22f6e7a40315bf8af5a849210b0e4b4266827900b9077694137ed7b764"}},"sha256":"376d571ad1cd78b82a99a64dfb174e02532d13202bfa3b03bb785e7940be4b36"}},"enums":{},"records":{"__ink_instance_db378b22f6e7a40315bf8af5a849210b0e4b4266827900b9077694137ed7b764":[["item","U32"],["valid","Bool"]]},"schema":1},"from":{"node":{"Op":["field:valid",[{"node":{"Op":["apply",[{"node":{"Lambda":{"node":{"Op":["apply",[{"node":{"Lambda":{"node":{"Op":["call:__ink_construct_85d8ad15f74c2e043a8b42019ea3296084e3d9b1e9fad9317f5b5b7d16c1f807",[{"node":{"Bound":1},"sort":{"Value":"U32"}},{"node":{"Bound":0},"sort":{"Value":"Bool"}}]]},"sort":{"Value":{"Named":"__ink_instance_db378b22f6e7a40315bf8af5a849210b0e4b4266827900b9077694137ed7b764"}}}},"sort":{"Arrow":[{"Value":"Bool"},{"Value":{"Named":"__ink_instance_db378b22f6e7a40315bf8af5a849210b0e4b4266827900b9077694137ed7b764"}}]}},{"node":{"Bool":true},"sort":{"Value":"Bool"}}]]},"sort":{"Value":{"Named":"__ink_instance_db378b22f6e7a40315bf8af5a849210b0e4b4266827900b9077694137ed7b764"}}}},"sort":{"Arrow":[{"Value":"U32"},{"Value":{"Named":"__ink_instance_db378b22f6e7a40315bf8af5a849210b0e4b4266827900b9077694137ed7b764"}}]}},{"node":{"Free":"item"},"sort":{"Value":"U32"}}]]},"sort":{"Value":{"Named":"__ink_instance_db378b22f6e7a40315bf8af5a849210b0e4b4266827900b9077694137ed7b764"}}}]]},"sort":{"Value":"Bool"}},"params":{"item":{"Value":"U32"}},"proof":"Normalize","to":{"node":{"Bool":true},"sort":{"Value":"Bool"}}},"schema":1,"semantics":"ink-conditional-laws-v1"}
