{"dependencies":["0b2896fb7d4c314eaa4cc523062f4bd60f41252eb902ea01642e234e34631989","1766594606572caae093691ee36f214bcd9165f3a6e4f8f07f0e2882d2657d20","21fe09113fe56a272ab565ab4aef7285fe5fd5a3732acf7e64eb606601da7041","278f96199151750d38923eeddb65a2c9b439d8b9d36ae2f7f74c9045f0fffb08","2faf23165826fe0b181fd976b7f28d5f2ba41c4a5e6f50b2a76dbe22c7e2528d","3b01e83ed63a97250c8f98bfe06df656c66cf51970b389324840292525a5eb7b","6f8e415e736e12c21104a8af10e51765553fc40e02938896d3db102301246906","6fb70d0ae302353570efe099ec6b68ed9f8dbaff3bab8b66be8ff802d60e925a","70e688e22d70f509933d86798827545906a33c9094356ad2715da19f9a858186","782628ab95dd828a24fb4b442e55f58436200200a31424ec2d88eeac2d8957ac","7ab58469556b7477018be1ec17a0774bb1f2faf62ae60a6ba08190b8047763df","8ae58fc1b31c019758415a3b71fb906586a69ae64e4976e66305fee453ba70eb","90d019f3bff7dfad54375d536ab586d6bd583cc7f5740c065404b0d38e8272c5","92368800572ebbcfe203c07e2d7e7e00d60743f84b2b815a526d470566792f7f","ac2c1db24f67f5eeec05605e3cf130d5fbaed94c0efa5dc012dfde27243a2bb0","adcd3fa9b78c3423a2204ad28dca815dad36dad9f2d4c473523118840077a669","b0bf897e4894cbe32c22fd6076f9458542fbdc25a9641bd507d85784efe0d5ac","baa9fb170ac2322a5cbf5fab9c84873a889f82bfd5054af51e8177bfc756899c","c6927b0865f87bb196f15f68b8badb81fa1be85d4df74ec9dc19dc46fb41576b"],"interface":{"conditions":[],"effects":[],"operations":["binary:+"],"parameters":{"word_0":"U64","word_1":"U64"},"result":null},"kind":"theorem","payload":{"declaration":{"Theorem":{"conditions":[],"from":{"Binary":{"left":{"Var":"word_0"},"op":"+","right":{"Var":"word_1"}}},"params":[["word_0","U64"],["word_1","U64"]],"proof":{"Trans":[{"Use":{"arguments":[{"Var":"word_0"},{"Var":"word_1"}],"premises":[],"theorem":"2faf23165826fe0b181fd976b7f28d5f2ba41c4a5e6f50b2a76dbe22c7e2528d"}},{"Sym":{"Use":{"arguments":[{"Var":"word_0"},{"Var":"word_1"}],"premises":[],"theorem":"8ae58fc1b31c019758415a3b71fb906586a69ae64e4976e66305fee453ba70eb"}}}]},"to":{"Binary":{"left":{"Binary":{"left":{"Var":"word_0"},"op":"+","right":{"U64":0}}},"op":"+","right":{"Var":"word_1"}}}}}},"schema":1,"semantics":"first-order-inductive-equality-v1"}
