{"dependencies":["12dcf02e9b3f08483db2ec22cdb1ad25247847367f5f2fbd8af9ee6baacbe048","15070653746526eea4bfe13a2032f46ec0290c501caee75e61736b395aa399ba","203d7933d34dc1d21a7d7dfed20a034b8b368d042c073b2dd75a6127a39f02f1","53304bf51834a19d48f37a4da5bcd74d260f40dc8f38755e79b3e1e245fcb4f8","5d116f2aef9d8b86141c043dd26a937186ba302140be5285f1cc211b0721fbc2","65f53d456c1a2e55966f309c62dbf3728b5799a3c28c6057252984918f150744","68932ee2951ba71ce09b48d63b84d7d51463c2836f62a4028b228fd1d1270e42","8cec548bbc3a690bd52bdf434f7df2bb7e3c5601125c2677c5d01e1f8a95cf5b","bbaa24bb122a763fae34e1d1d91f6d81b8d81e14730fa3d4a87f7bafbb02e0bf","ccc854890c4c12a347de081881cdfd73852edba491bd715aa9ea99b29742201c","e3074a3fd02767deb01e7e726d0f0c176422bbd41f9d57c76faaa71cf86c7c53","ec372e5a49b936665280b1b1a4f8eb9c9aeccb3bc4334bb8e1a07afb669c7915","ed7bb6bb4f0f10743c33bc1b4dba989be03a8df40e929284cdef778f6890bd6c","ed7efcbaf5d6945610a95ad6a49bd81d8f3ab370cb68f29838d8afbe55ce70f9"],"interface":{"conditions":[],"effects":[],"operations":["call:bbaa24bb122a763fae34e1d1d91f6d81b8d81e14730fa3d4a87f7bafbb02e0bf","call:e3074a3fd02767deb01e7e726d0f0c176422bbd41f9d57c76faaa71cf86c7c53"],"parameters":{"wrapped":{"Data":"53304bf51834a19d48f37a4da5bcd74d260f40dc8f38755e79b3e1e245fcb4f8"}},"result":null},"kind":"theorem","payload":{"declaration":{"Theorem":{"conditions":[],"from":{"Call":{"arguments":[{"Call":{"arguments":[{"Var":"wrapped"}],"function":"e3074a3fd02767deb01e7e726d0f0c176422bbd41f9d57c76faaa71cf86c7c53"}}],"function":"bbaa24bb122a763fae34e1d1d91f6d81b8d81e14730fa3d4a87f7bafbb02e0bf"}},"params":[["wrapped",{"Data":"53304bf51834a19d48f37a4da5bcd74d260f40dc8f38755e79b3e1e245fcb4f8"}]],"proof":{"Cases":{"cases":[{"bindings":["payload"],"proof":{"Convert":{"from":{"Call":{"arguments":[{"Call":{"arguments":[{"Construct":{"arguments":[{"Var":"payload"}],"constructor":0,"datatype":"53304bf51834a19d48f37a4da5bcd74d260f40dc8f38755e79b3e1e245fcb4f8"}}],"function":"e3074a3fd02767deb01e7e726d0f0c176422bbd41f9d57c76faaa71cf86c7c53"}}],"function":"bbaa24bb122a763fae34e1d1d91f6d81b8d81e14730fa3d4a87f7bafbb02e0bf"}},"to":{"Construct":{"arguments":[{"Var":"payload"}],"constructor":0,"datatype":"53304bf51834a19d48f37a4da5bcd74d260f40dc8f38755e79b3e1e245fcb4f8"}}}}}],"from":{"Call":{"arguments":[{"Call":{"arguments":[{"Var":"wrapped"}],"function":"e3074a3fd02767deb01e7e726d0f0c176422bbd41f9d57c76faaa71cf86c7c53"}}],"function":"bbaa24bb122a763fae34e1d1d91f6d81b8d81e14730fa3d4a87f7bafbb02e0bf"}},"to":{"Var":"wrapped"},"variable":"wrapped"}},"to":{"Var":"wrapped"}}}},"schema":1,"semantics":"first-order-inductive-equality-v1"}
