{"dependencies":["a947d9daad840fb69381ccfdc369e703ea5864877e42965da1cd33a70f9bc3f9"],"interface":{"conditions":[],"effects":[],"operations":[],"parameters":{},"result":null},"kind":"definition","payload":{"declaration":{"Datatype":{"constructors":[{"fields":[],"name":"Nil"},{"fields":[{"Data":"a947d9daad840fb69381ccfdc369e703ea5864877e42965da1cd33a70f9bc3f9"},"SelfType"],"name":"Cons"}]}}},"schema":1,"semantics":"first-order-inductive-equality-v1"}
